{
  "format": "seqcraft.logicblock",
  "version": 1,
  "pulseq": "1.5",
  "opts": {
    "max_grad": 1703040,
    "max_slew": 6386400000,
    "max_b1": 1000,
    "max_freq_offset": 250000,
    "rise_time": null,
    "rf_dead_time": 0.0001,
    "rf_ringdown_time": 0.00003,
    "adc_dead_time": 0.00001,
    "adc_raster_time": 1e-7,
    "rf_raster_time": 0.000001,
    "grad_raster_time": 0.00001,
    "block_duration_raster": 0.00001,
    "adc_samples_limit": 0,
    "rf_samples_limit": 0,
    "adc_samples_divisor": 4,
    "flag_trid": true,
    "gamma": 42576000,
    "b0": 3
  },
  "definitions": {
    "FOV": [0.22, 0.22, 0.005]
  },
  "root": {
    "tag": "minimal",
    "nodes": [
      {
        "start_s": 0,
        "event": {
          "type": "delay",
          "delay": 0.001
        }
      },
      {
        "start_s": 0.001,
        "block": {
          "tag": "readout",
          "nodes": [
            {
              "start_s": 0,
              "event": {
                "type": "trap",
                "channel": "x",
                "amplitude": 100000,
                "rise_time": 0.0001,
                "flat_time": 0.0008,
                "fall_time": 0.0001,
                "area": 90,
                "flat_area": 80,
                "delay": 0,
                "first": 0,
                "last": 0
              }
            },
            {
              "start_s": 0,
              "event": {
                "type": "adc",
                "num_samples": 64,
                "delay": 0.0001,
                "freq_offset": 0,
                "phase_offset": 0,
                "freq_ppm": 0,
                "phase_ppm": 0,
                "dead_time": 0.00001,
                "phase_modulation": [],
                "dwell": 0.00001
              }
            }
          ]
        }
      },
      {
        "start_s": 0.002,
        "barrier": "end"
      }
    ]
  }
}
